BARBARIAN;
Barbarians come in a lot of different shapes and sizes, but most tend to be taller and more muscular than other classes. They have faces that let them look intense and animalistic. They have powerful builds, so they're able to use heavy weapons and carry lots of equipment.;
Their arms tend to be long, and they have rough skin. Coming up with a good physical description for your barbarian character is important because it can help you to think about how your character's appearance will affect their behavior and outlook on life.;
Barbarians wear clothes that are rough and rugged. While many stereotypes depict barbarians as wearing nothing but a loincloth, but this is rarely true. Barbarians come from the wilds outside society, but this doesn't mean that they don't have their own sense of class and style. Some barbarian cultures favor colorful clothing and ornate jewelry.;
Barbarians are in a constant state of physical conflict, so it's common for them to have obvious signs of past wounds. Barbarians also sometimes use scars and battle marks as tattoos, so if you have the option, you might want to avoid using the deformity rules.;
Barbarians have unkempt hair and rough facial features. Generally, they have a low brow, prominent nose, and thin lips. Shaggy hair and unkempt beards are common.;
Barbarians have tough, thick skin and are sometimes covered in scars. They often have a healthy tan.;
Barbarians have long, messy hair. They sometimes have beards. They are also some few characters who are allowed to wear their hair long.;
There is no cultural norm for hair color, but most barbarians have dark hair or hair that is dark at the roots and light at the ends.;
While there's no cultural norm for eye color, most barbarians have dark eyes.;
Barbarians have a strong sense of community and honor. They are proud and believe in living as close to nature as possible. Barbarians are also traditionalists. They respect the traditions of the past, especially those that are related to warfare and combat.;
They have a sense of duty and honor, and they follow a strict code. They consider their actions to be the result of the decisions that they make, and they would never seek to blame others for their decisions.;
Barbarians are generally at peace with most species and cultures. They tend to get along with those who have warrior traditions. They are also closely tied to the natural world, so they are usually in harmony with nature.;
It is unusual for a barbarian to worship a god. Barbarians generally find it more natural to worship a pantheon of gods or nature. Many barbarians believe that they are a living incarnation of a god. Although barbarians have no formal religion, they have a strong sense of honor and loyalty. They try to emulate their gods by living in harmony with nature and fulfilling their duties.;
Barbarians are usually adventurers just because they don't really know what else to do. They have an inherent wanderlust and a desire to stand out. They have a strong sense of honor, so they often look for opportunities to prove themselves. They are natural leaders, so they often rise to leadership positions in groups.;
Your barbarian character has a strong sense of honor and tradition. They have close relationships with their tribe members, family members, and friends. They are used to fighting, and they see battle as a natural part of life. They aren't afraid to fight, and they aren't afraid to die. They don't see life as something that should be wasted.;
Your barbarian character has a sense of community and responsibility. They are loyal to their friends and family, and they have an obligation to protect the weak and innocent. They are used to adapting to dangerous situations and taking care of themselves. They have seen terrible things, but they choose to keep fighting so that they can protect others.;
Your barbarian character is a traditionalist. They have a strong sense of duty and honor, and they follow a strict code. They consider their actions to be the result of the decisions that they make, and they would never seek to blame others for their decisions.;
Your barbarian character has a strong sense of honor and duty. They are often the leaders in their groups. They are often used to being in dangerous situations, and they make good group leaders because they are used to dealing with difficult situations. They like to fight, and they are able to keep their groups moving in the right direction.;
These barbarians, different as they might be, are defined by their rage: unbridled, unquenchable, and unthinking fury. More than a mere emotion, their anger is the ferocity of a cornered predator, the unrelenting assault of a storm, the churning turmoil of the sea.;
For some, their rage springs from a communion with fierce animal spirits. Others draw from a roiling reservoir of anger at a world full of pain. For every barbarian, rage is a power that fuels not just a battle frenzy but also uncanny reflexes, resilience, and feats of strength.;
Not every member of the tribes deemed barbarians by scions of civilized society has the barbarian class. A true barbarian among these people is as uncommon as a skilled fighter in a town, and he or she plays a similar role as a protector of the people and a leader in times of war. Life in the wild places of the world is fraught with peril: rival tribes, deadly weather, and terrifying monsters. Barbarians charge headlong into that danger so that their people don't have to.;
Their courage in the face of danger makes barbarians perfectly suited for adventuring. Wandering is often a way of life for their native tribes, and the rootless life of the adventurer is little hardship for a barbarian. Some barbarians miss the close-knit family structures of the tribe, but eventually find them replaced by the bonds formed among the members of their adventuring parties.;
Barbarians are all about getting angry and dealing damage. They have a ton of hit points, resistance to damage, and Rage gives a wonderful bonus to damage. Barbarians don't get much in the way of skills, so generally they're stuck as combat monsters, but they function equally well as a defender and a striker, and certain character options can even expand them into a limited support role.;
The Barbarian is notoriously useless outside of combat because their class features are almost exclusively dedicated to act of violence. ;
Barbarians are melee fighters highly trained in the arts of weaponry. These mighty warriors, strong and quick on the battlefield, depend on their heavy plate armor, shields, and battle prowess to defend themselves and ensure enemies don't focus on their softer-skinned allies. Weapon mastery is a staple of warrior training, and they are capable of delivering high damage with enormous two-handed weapons or by wielding two weapons. As barbarians deal or take damage, their rage grows, allowing them to deliver truly crushing attacks in the heat of battle.;
Barbarians are usually leading the charge into battle, tearing across the battlefield and using furious shouts and terrifying banners to rally their allies and intimidate their enemies. Whether striking down opponents with mighty two-handed weapons, tearing into packs of enemies in a whirlwind of steel, or standing firm in the face of death itself, warriors excel at battle with a range of powerful attacks and battlefield maneuvers, as masters of both skillful strikes and devastating blows.;
Barbarians equip themselves carefully for combat and engage their enemies head-on, letting attacks glance off their heavy armor. They use diverse combat tactics and a wide variety of weapon types to protect their more vulnerable allies. Barbarians must carefully master their rage - the power behind their strongest attacks - in order to maximize their effectiveness in combat.;
Barbarian talents can improve their already considerable defenses with a shield, increase their deadliness with two-handed weapons, or bolster their savagery while dual-wielding.;
Barbarians are the quintessential fearless fighters on the battlefield, and their pure martial prowess inspires courage in allies and despair in enemies. Experts in all manner of melee weaponry and possessing incredible physical strength and skill, Warriors are perfectly suited to serve as frontline combatants and battlefield commanders.;
Every dragon slain, corrupted tyrant toppled, and demon banished from Dreary Forest has trembled in the face of these lords of war.;
Barbarians train constantly and strive for perfection in armed combat. Though they come from all walks of life, they are united in their singular commitment to engage in glorious battle. Many warriors serve as mercenary soldiers, while others become adventurers and danger-seeking fortune hunters. A typical warrior is strong, tough, and exceptionally violent.;
Combining a mastery of weapons and prowess in battle, Barbarians storm fearlessly into the front lines of any fight.;
Strength saves are fairly rare, but constitution saves are common and typically very problematic.;
Medium armor and martial weapons will get you a long way, but you get no tool proficiencies, and only two skills.;
Rage is the Barbarian's defining class feature. The bonus damage isn't huge, but it's reliable and consistent. The resistance to damage makes Barbarians exceptionally durable. You can rage multiple times in the same encounter if you absolutely need to, but your number of rages per day is limited, so try not to do so if you can avoid it.;
She is a fighter, through and through. She's tough and headstrong, never giving up until her opponent is down. She's a little dense sometimes, however, and it takes her a while to realize when she's outmatched by her opponent. She is very loyal to her friends, and she uses her muscles and brawn to protect them. She also loves to tell a joke or a story, making her a fun person to be around.;
She is tall and brawny. She has bright red hair, cropped short. Her bright green eyes are constantly assessing her surroundings while she's out on the road. Her vest is very practical, with a number of small pouches attached all around. She wears a small bag on her side, with a short sword strapped to her back.;
The Barbarian is a champion, swordsman, swordswoman, soldier, and brawler who lives or dies by the knowledge of weapons and tactics. Barbarians can be found at the front of any battle, contesting toe-to-toe with monsters and villains. A good Barbarian needs to be strong and healthy if they hope to survive.;
Barbarians can be excellent warriors. While not as disciplined or as skilled as a normal fighter, the barbarian can willingly throw himself into a berserker rage, becoming a tougher and stronger opponent. Barbarians can't use plate mail armor, unlike the other three warrior classes. They use the fighter avatar for their appearance. The Barbarian can draw from a high level ability pool which gives the barbarian some extra abilities.;
He is a very friendly, outgoing person who just loves to share a good drink with anyone willing to listen. He's never afraid to speak his mind, even if it gets him in trouble. He's happy with his life as an adventurer and looks forward to seeing the world. He loves a good fight as much as the next barbarian, but he doesn't like to kill. Well, not all the time. If his life or a friend's life is in danger, he will totally destroy his enemies. He has a soft spot for other barbarians, however, even if they are from a different tribe.;
He also has a fear of large creatures, like trolls and giants, and he has a crippling fear of bees. This came about because of his childhood, where a giant and a bee attacked him when he was a young boy. He knows this fear isn't rational, but he can't help it. If he sees a bee, he will go into a barbarian rage, attacking the bee and anyone who gets in his way. He will stop when the bee is dead or he is dead. Other than the bees and giants, he is a fearless fighter who will attack anyone that gets in his way.;
I don't like to see the world in black and white. I like to see it in color. I love to talk to new people and learn about their culture, their life and their history. I just wish it didn't always come down to fighting.;
He is a tall man with slightly long brown hair. He tends to wear whatever is comfortable, usually something unusual, like a cloak made from a lion's hide. He's not a very handsome man, but he moves with great, athletic strength. When in battle, he usually wears next to nothing, save for a metal breast-plate taken from a slain berserker. He carries a war hammer, which he forged himself from the metal of a fallen statue. He keeps his hair greasy so opponents can't get a good grip on him.;
He has a scar running along the left side of his face, from his forehead down to his chin. He got this from a duel with a baby dragon that got out of hand, as his previous battle scars testify. His left ear is also slightly deformed, but he wears an earring in it. He speaks with a thick accent and swears a lot. He's a loud, boisterous man who laughs and tells stories constantly. He acts like a berserker who fights for the fun of it. Overall, his appearance tends to scare people away, and he's fine with that.;
He likes his life of adventure, traveling the countryside, earning gold, and drinking. He has no interest in settling down, but he's always open to hearing about it. He is traveling the Kingdom, trying to make his fortune fighting the orcs and other monsters. He's been looking for a unique magic item that many say don't exist a lute of persuasion. He's heard rumors of such an item but has never seen it. ;
He has long dark hair and sharp yellow eyes. He has rough, black fur covering his body, and he has sharp fingernails and long, sharp teeth. He wears dark blue and black clothes, but he often carries around a black cloak and hood in case he needs to hide in the shadows.;
He is a slight, dark-haired halfling. He has a small, oval-shaped head, and a long, thin chin. He has a thin, scraggly mustache and a beard of the same color. His eyes are deep-set and sad. He wears a small golden necklace of his grandmother's, and a small brown belt with a shiny buckle. He wears simple clothes, and a nice, brown vest. He wears a small, multi-colored backpack with a picture of a tree on it.;
He was born into a long line of miners. His father was dark and one day disappeared during a dark storm. He was out in the mines, and never returned. His mother was heartbroken, and left with him. They moved to the kingdom, and lived there for many years. He grew up on a farm on the outskirts of kingdom. He received lessons on how to farm, and learned from the many farmers around him. Soon, he was old enough to fight and he decided to start the adventure.;
He is a calm and collected fellow. He is a very quiet man who enjoys spending time alone. He is wise and very mature, but he can sometimes be a bit short-tempered. He's a kind man and will help anyone out who needs it.;
He isn't very trusting of people he doesn't know, taking a while to warm up to them. He also has very little patience for jokers. Once he knows someone, he's extremely loyal and a good friend. He's often prone to being headstrong, but he's quick to admit when he's wrong.;
He has green eyes and midnight black hair. His most distinguishing feature is the tattoo of his late mother on his left arm. He's very muscular and he has a strong, angular face. He wears hide armor and black trousers. The only weapons he requires is a small shield and a large knife.;
Barbarians had a reputation, perhaps not completely deserved, as reckless ruffians and savage nuisances who needless disrupted society by acts of mayhem. However, barbarians, while undoubtedly feral and unpredictable by the nature of their rages, were not necessarily uncultured brutes. Time and time again, barbarians proved their cunning and resourcefulness as well as their sheer physical power and endurance. Sometimes, in spite of their aversion to an organized order, barbarians even demonstrated honor.;
She is happy and outgoing. She loves life and is willing to jump into any adventure. She is always looking for a challenge. She is also fearless and stubborn. She does not let anyone get in the way of what she wants. When she meets a dragon, she is ready and willing to fight. She always wants to be doing something exciting, and she is never afraid to try anything. She is curious about everything around her.;
Barbarian is an insulting word for a person from an uncivilized culture or a person with no manners. Barbarians aren't known for their etiquette.;
Barbarian is a crude uncouth ill-bred person lacking culture or refinement.;
This fearless warrior relies on his bulging muscles and striking mustache to wreak havoc in enemy villages. Release a horde of Barbarians and enjoy the mayhem!;
He appears as a male kilt-clad warrior with an angry, battle-ready expression, hungry for destruction. He has close-cropped blond hair and a long, yellow horseshoe mustache. In battle, he wields a sword which he uses to attack.;
Barbarians primary ability is strength, their saving throw proficiencies are strength and constitution.;
A barbarian's true strength lies not in the body, but in the spirit.;
A nomadic wanderer, the Barbarian combines brawn and ruggedness with a mastery of weapons, using devastating melee attacks along with war cries to boost his allies' or demoralize his enemies.;
Glorified by many a song and fireside tale, the Barbarian is unrivaled in delivering unrelenting melee fury on anyone foolish enough to greet their axe-head.;
The Barbarian has unparalleled strength and expertly wields an entire arsenal in battle, with a weapon for every occasion. He bellows intimidating war cries and unleashes ground-shaking slams to send approaching hordes reeling.;
A brutal, physical warrior, the Barbarian roams around the battlefield constantly, dishing heavy damage and wielding an array of powerful weapons with ease.;
Barbarians come alive in the chaos of combat. They can enter a berserk state where rage takes over, giving them superhuman strength and resilience. A barbarian can draw on this reservoir of fury only a few times without resting, but those few rages are usually sufficient to defeat whatever threats arise.;
Barbarians are mighty warriors who relied on their strength and incredible toughness, characterized by a bestial rage empowered either by ancestral totems and nature spirits or an inner passion for violence. Barbarians were less versatile than fighters but were tougher and capable of dealing heavy damage to their foes much more quickly.;
Barbarian is a creature class. Barbarians, are warriors who have sworn their service and their lives to a single authority figure, usually a feudal lord.;
Most barbarians are noble and serve their duty unflinchingly. Barbarians are often equipped with a longsword and a shortsword in many lands whert barbarians are found, they are the only citizens allowed to carry more than one weapon. The ability, representing their power in combat, is exclusive to barbarians. Most barbarians are aligned with white.;
Some barbarians, due to personal dishonor or the death of their lord, become rogues called ronin. Ronin may be just as honorable as othet barbarians or as underhanded as the darkest rogue. Ronin are usually black or red.;
Barbarian is a creature class. They are tough and disciplined, adept at fighting in concert, and overwhelming the enemy.;
DWARF;
Bold and hardy, dwarves are known as skilled warriors, miners, and workers of stone and metal. Though they stand well under 5 feet tall, dwarves are so broad and compact that they can weigh as much as a human standing nearly two feet taller. Their courage and endurance are also easily a match for any of the larger folk.;
Dwarven skin ranges from deep brown to a paler hue tinged with red, but the most common shades are light brown or deep tan, like certain tones of earth. Their hair, worn long but in simple styles, is usually black, gray, or brown, though paler dwarves often have red hair. Male dwarves value their beards highly and groom them carefully.;
Individual dwarves are determined and loyal, true to their word and decisive in action, sometimes to the point of stubbornness. Many dwarves have a strong sense of justice, and they are slow to forget wrongs they have suffered. A wrong done to one dwarf is a wrong done to the dwarf's entire clan, so what begins as one dwarf's hunt for vengeance can become a full-blown clan feud.;
Dwarves in other lands are typically artisans, especially weaponsmiths, armorers, and jewelers. Some become mercenaries or bodyguards, highly sought after for their courage and loyalty.;
Dwarves who take up the adventuring life might be motivated by a desire for treasure for its own sake, for a specific purpose, or even out of an altruistic desire to help others. Other dwarves are driven by the command or inspiration of a deity, a direct calling or simply a desire to bring glory to one of the dwarf gods. Clan and ancestry are also important motivators. A dwarf might seek to restore a clan's lost honor, avenge an ancient wrong the clan suffered, or earn a new place within the clan after having been exiled. Or a dwarf might search for the axe wielded by a mighty ancestor, lost on the field of battle centuries ago.;
Physically durable, insightful, primarily dwell underground, some females capable of growing beards.;
Dwarves were a natural humanoid race common throughout parts of Frozen Empire as well as Desolation of abomination. Dwarves were a tough, tradition-abiding folk known for their strong martial traditions and beautiful craftsmanship.;
Dwarves were a short race, as their name implied, standing from 1.3 - 1.45 meters on average, with gold dwarves a bit shorter. What dwarves lacked in height they made up for in bulk; they were, on average, about as heavy as humans. A dwarf could weigh anywhere from about 73-100kg. Dwarven males were a bit taller and heavier than their female counterparts. Like humans, dwarves had a wide variety of skin, eye, and hair colors, typically pale among shield dwarves and deeply tanned or brown amongst gold dwarves. Hazel eyes were common throughout the race, with blue eyes more common amongst shield dwarves and brown or green eyes found amongst the gold dwarves.
Dwarves were a long-lived race, though not so much as elves, and reached physical maturity somewhat later than humans. A dwarf was traditionally considered an adult once he or she reached age fifty. Dwarves aged much like humans but over a longer period of time, remaining vigorous well past 150 years. Most dwarves lived to see their bicentennial and a few lived to be over 400. A dwarf was considered to be young until they reached the age of 50.;
Whether or not the dwarven claim that they'd been carved from the world's stone was true, dwarves shared many qualities considered similar to the stone they lived with. Strong, hardy, and dependable, dwarves were polite, particularly to elders, and possessed a wisdom beyond that of many other races. Dwarves valued their traditions, regardless of the subrace they came from, and looked for inspiration from ancestral heroes. Dwarves were also known for their stubborn nature and cynicism, traits widespread amongst the dwarves but which contributed to and were commonly offset by their bravery and tenacity.;
Dwarven friendship was hard to earn, but was strong once won. Naturally dour and suspicious, the stout folk were slow to trust others, specifically those outside their family, suspecting the worst of an individual until the outsider had proved their good will many times. Once this trust was gained, dwarves held their friends to it and viewed betrayals, even minor ones, with a vicious propensity for vengeance. A common gnomish oath, remarking on this dwarven sense of justice, was If I'm lying, may I cross a dwarf.;
A dwarf advises on a matter of diplomacy. For dwarves, loyalty was more than a word and they felt that it should be both valued and rewarded. Dwarves believed it a gift and mark of respect to stand beside a friend in combat, and an even deeper one to protect that ally from harm. Many dwarven tales subsequently revolved around the sacrifice of dwarves for their friends and family. Just as dwarves were known for their dependability as friends and allies, dwarves also harbored grudges far longer than many other races. This might be on an individual basis between a dwarf and one who had wronged them, or against entire races, even if warfare with the enemy had long since ceased.;
Dwarves were careful and deliberate, with a more serious disposition than other races, who they sometimes viewed as flighty or reckless. A dwarf did all things with care and a stubborn resolve, with brash or cowardly behavior unusual for them. However, dwarves did succumb easily to wrath or greed, which were their most common vices.;
Dwarves who left their homeland to become adventurers did so for a number of reasons. In part, a dwarf might be motivated by simple avarice, given the dwarven love of beautiful things. As often, however, a dwarf might be motivated by a drive to do what was right for others (particularly their clan) or a love of excitement because, as settled as dwarves were, they rarely tired of thrills. But even these wayward dwarves retained the spirit of their brethren, hoping that their accomplishments abroad could bring honor to themselves, their clan, or both. Given that successful dwarven adventurers were likely to recover rare items or defeat enemies of the dwarven people during such challenges, this was a hope not entirely without merit.;
