BARBARIAN;
Many dwarves were difficult to like and lacked the charm of many other smaller races, such as halflings or gnomes, though this was not a trait common to all dwarves and some possessed a great deal of charismatic power. Furthermore, dwarves were not entirely unsocial and more than a few had a natural knack for bartering or judging the value of an offer, something that sat well with their legendary crafting abilities.;
Whether or not the dwarven claim that they'd been carved from the world's stone was true, dwarves shared many qualities considered similar to the stone they lived with. Strong, hardy, and dependable, dwarves were polite, particularly to elders, and possessed a wisdom beyond that of many other races. Dwarves valued their traditions, regardless of the subrace they came from, and looked for inspiration from ancestral heroes.  Dwarves were also known for their stubborn nature and cynicism, traits widespread amongst the dwarves but which contributed to and were commonly offset by their bravery and tenacity.;
Dwarven friendship was hard to earn, but was strong once won. Naturally dour and suspicious, the stout folk were slow to trust others, specifically those outside their family, suspecting the worst of an individual until the outsider had proved their good will many times. Once this trust was gained, dwarves held their friends to it and viewed betrayals, even minor ones, with a vicious propensity for vengeance.  A common gnomish oath, remarking on this dwarven sense of justice, was If I'm lying, may I cross a dwarf.;
A dwarf advises on a matter of diplomacy.For dwarves, loyalty was more than a word and they felt that it should be both valued and rewarded. Dwarves believed it a gift and mark of respect to stand beside a friend in combat, and an even deeper one to protect that ally from harm. Many dwarven tales subsequently revolved around the sacrifice of dwarves for their friends and family. Just as dwarves were known for their dependability as friends and allies, dwarves also harbored grudges far longer than many other races. This might be on an individual basis between a dwarf and one who had wronged them, or against entire races, even if warfare with the enemy had long since ceased.;
Dwarves were careful and deliberate, with a more serious disposition than other races, who they sometimes viewed as flighty or reckless. A dwarf did all things with care and a stubborn resolve, with brash or cowardly behavior unusual for them. However, dwarves did succumb easily to wrath or greed, which were their most common vices.;
Dwarves who left their homeland to become adventurers did so for a number of reasons. In part, a dwarf might be motivated by simple avarice, given the dwarven love of beautiful things. As often, however, a dwarf might be motivated by a drive to do what was right for others (particularly their clan) or a love of excitement because, as settled as dwarves were, they rarely tired of thrills. But even these wayward dwarves retained the spirit of their brethren, hoping that their accomplishments abroad could bring honor to themselves, their clan, or both. Given that successful dwarven adventurers were likely to recover rare items or defeat enemies of the dwarven people during such challenges, this was a hope not entirely without merit.;
Many dwarves were difficult to like and lacked the charm of many other smaller races, such as halflings or gnomes, though this was not a trait common to all dwarves and some possessed a great deal of charismatic power. Furthermore, dwarves were not entirely unsocial and more than a few had a natural knack for bartering or judging the value of an offer, something that sat well with their legendary crafting abilities.;
Dwarves could see in the dark, out to about 60 feet (18 meters). Many dwarves had an affinity for the caverns in which they lived, possessing a knack for recognizing unusual patterns in stonework that could seem almost supernatural at times.;
A dwarf having a snooze after eating. Dwarves highly valued the ties between family members and friends, weaving tightly knit clans. Dwarves particularly respected elders, from whom they expected sound leadership and the wisdom of experience, as well as ancestral heroes or clan founders. This idea carried on to relations with other races and dwarves were deferential even to the elders of another, non-dwarven race.;
Likewise, dwarves, perhaps moreso than most other races, turned to their gods for guidance and protection. Non-evil dwarves looked to the divine for comfort and inspiration, while the wicked looked to their divine overlords for methods through which to obtain power over others. Individual dwarves might be faithless, but the race as a whole, regardless of subrace, had a strong inclination for religion and almost every community maintained at least one temple or ancestral shrine.;
Most dwarven societies were divided into clans built along family ties and political allegiances. These clans were usually led by hereditary rulers, often monarchs of a sort and descended from the founder of the clan. Dwarves strongly valued loyalty to these rulers and to the clan as a whole and even objective dwarves tended to side primarily with their kin over other races or communities.;
Most dwarven clans focused on one or two kinds of crafting, such as blacksmithing, jewelry, engineering, or masonry. Dwarves strove to avoid overspecialization by sending some of their youths to other clans to serve as apprentices, which also helped to foster racial unity. Because of their longevity, these apprenticeships might last decades.;
Most dwarves preferred living in underground cities near the surface in the mountains, built around mines that provided much of their livelihood. Carved into stone, these cities might take centuries to complete but were practically ageless once finished. Though dwarves were typically a martial race by nature, these cities had civilian populations that made up about one fourth of the total population and which were made up primarily of the young, the elderly, or a few regular adults. Females typically composed as large a portion of the military as male dwarves did.;
Dwarves were a short, stocky race, a little taller than goblins but much broader and heavier. Most Dwarves had thick, luxuriant beards in which they took great pride, and often forked or braided them and tucked them into their belts.;
They seem to have favoured simple durable clothing, coloured hoods and heavy cloaks for travelling, and belts of gold or silver. For battle their soldiers would have elaborately crafted armor and helmets, bearing various angles and styles that were trademarks of Dwarven crafting styles. Their armor was masked with symbols (after the manner of those used in forges for shielding the eyes) that were hideous to look upon.;
They had a knack for starting a fire almost anywhere out of almost anything. Although they knew how, Dwarves did not farm or herd often, as they preferred to spend their time underground mining and crafting. They rather traded crafted items with Men and Elves in exchange for food.;
They were also capable masons and smiths - Dwarven smithying skills were said to be rivaled only by those of the Elves, and their masonry creations were bested by none. The skill of the Dwarves was unmatched they crafted objects of great beauty out of diamond, emerald, ruby and sapphire. Everything Dwarven was beautifully crafted and intricate. They crafted many famed weapons, armors, and items of art and beauty.;
Dwarves were taught special skills and spent most of their time crafting, smithying and mining in their massive underground cities.;
Dwarves were a proud and stern race and were made to be sturdy to resist the dangers of their time. They were physically very strong, had great endurance, especially in the ability to resist heat and cold, and they made light of heavy burdens. Dwarves lived longer than Men, often up to two-hundred-and-fifty years. Dwarves had the ability to learn new artisanal skills quickly, especially those dealing with metal or stone.;
Dwarven women were alike in manner, voice and appearance to their menfolk. They were few in number, less than a third of all dwarf-kind, and they were seldom seen outside their own halls, often not venturing far due to their duties as caretakers and crafters in Dwarven society. They typically only travelled when in great need, and they usually dressed similarly to Dwarf men. This often led other folk to believe there were no women among the Dwarves, that Dwarves grew from stone when created. Few female Dwarven warriors were known, but some tales say that female Dwarves were as fierce as their male counterparts, especially in protecting their families and offspring. Dwarves were usually monogamous, and fewer than one-third of Dwarven men took a wife, the rest busying themselves with their crafts.;
For dwarves, loyalty was more than a word and they felt that it should be both valued and rewarded. Dwarves believed it a gift and mark of respect to stand beside a friend in combat, and an even deeper one to protect that ally from harm. Many dwarven tales subsequently revolved around the sacrifice of dwarves for their friends and family. Just as dwarves were known for their dependability as friends and allies, dwarves also harbored grudges far longer than many other races. This might be on an individual basis between a dwarf and one who had wronged them, or against entire races, even if warfare with the enemy had long since ceased;
Dwarves were careful and deliberate, with a more serious disposition than other races, who they sometimes viewed as flighty or reckless. A dwarf did all things with care and a stubborn resolve, with brash or cowardly behavior unusual for them. However, dwarves did succumb easily to wrath or greed, which were their most common vices;
Dwarves who left their homeland to become adventurers did so for a number of reasons. In part, a dwarf might be motivated by simple avarice, given the dwarven love of beautiful things. As often, however, a dwarf might be motivated by a drive to do what was right for others (particularly their clan) or a love of excitement because, as settled as dwarves were, they rarely tired of thrills. But even these wayward dwarves retained the spirit of their brethren, hoping that their accomplishments abroad could bring honor to themselves, their clan, or both. Given that successful dwarven adventurers were likely to recover rare items or defeat enemies of the dwarven people during such challenges, this was a hope not entirely without merit.;
Dwarves highly valued the ties between family members and friends, weaving tightly knit clans. Dwarves particularly respected elders, from whom they expected sound leadership and the wisdom of experience, as well as ancestral heroes or clan founders. This idea carried on to relations with other races and dwarves were deferential even to the elders of another, non-dwarven race.;
Most dwarves preferred living in underground cities near the surface in the Frozen Empire, built around mines that provided much of their livelihood. Carved into stone, these cities might take centuries to complete but were practically ageless once finished. Though dwarves were typically a martial race by nature, these cities had civilian populations that made up about one fourth of the total population and which were made up primarily of the young, the elderly, or a few regular adults. Females typically composed as large a portion of the military as male dwarves did;
In their own homelands, dwarves continuously carved out new living space, mining the mountains' riches as they did so. Dwarves in general stuck to these locales, disliking travel, particularly along waterways, but those who lived in human lands could make themselves quite comfortable. Most who did made a living as mercenaries, smiths, or artisans of various kinds. Dwarves were eagerly sought after as warriors, their reputation for courage and loyalty making them excellent choices for bodyguards;
Dwarves were firm believers in the righteousness of their own ways, yet were surprisingly tolerant of the cultures of others, much of which was due to their natural introversion. Polite dwarves normally declined to speak their minds about others regardless of their true feelings; behavior considered good enough was left alone and not considered their business. Certain violent behavior might prompt more direct forms of response, but for the most part dwarves would live and let live. They got along passably well with most other races, their pragmatism and sense of honor serving diplomacy well, and few reasonable societies could not come to some level of agreement of them.
They live around 250-350 years.;
Dwarves are stocky, bearded, never bald, especially hardy and loyal, stubborn.;
Dwarves are shorter than Men.;
Their hair can be blond, brown, black, blue, red, and (when older) grey or white.;
As a weapon they very often use axes, swords, hammers, mattocks.;
Long time ago, the dwarves made alliances with the elves, and both prospered from trade.;
Dwarves were a short, stocky race, a little taller than hobbits but much broader and heavier. Most dwarves had thick, luxuriant beards in which they took great pride, and often forked or braided them and tucked them into their belts.;
They seem to have favoured simple durable clothing, coloured hoods and heavy cloaks for travelling, and belts of gold or silver. For battle their soldiers would have elaborately crafted armor and helmets, bearing various angles and styles that were trademarks of dwarven crafting styles. Their armor was masked with symbols (after the manner of those used in forges for shielding the eyes) that were hideous to look upon.;
Dwarven women were alike in manner, voice and appearance to their menfolk. They were few in number, less than a third of all dwarf-kind, and they were seldom seen outside their own halls, often not venturing far due to their duties as caretakers and crafters in dwarven society. They typically only travelled when in great need, and they usually dressed similarly to dwarf men. This often led other folk to believe there were no women among the dwarves, that dwarves grew from stone when created. Few female dwarven warriors were known, but some tales say that female dwarves were as fierce as their male counterparts, especially in protecting their families and offspring. Dwarves were usually monogamous, and fewer than one-third of dwarven men took a wife, the rest busying themselves with their crafts.;
Dwarves were a proud and stern race and were made to be sturdy to resist the dangers of their time. They were physically very strong, had great endurance, especially in the ability to resist heat and cold, and they made light of heavy burdens. Dwarves lived longer than men, often up to two-hundred-and-fifty years. Dwarves had the ability to learn new artisanal skills quickly, especially those dealing with metal or stone.;
Dwarves were typically stubborn, secretive, and fiercely loyal to friends and family. They treat and care for each other, even strangers among their kind like family. They cared greatly about mining, crafting, crafts, gold and gems, their acquisition of which often fueled the envy of the elves. Dwarves were easily offended by rude comments, and had a propensity to hold long-lasting grudges. Dwarves were often seen as greedy, but their nature gave them resistance to many external influences. ;
They were also capable masons and smiths. Dwarven smithying skills were said to be rivaled only by those of the elves, and their masonry creations were bested by none. The skill of the dwarves was unmatched; they crafted objects of great beauty out of diamond, emerald, ruby and sapphire. Everything dwarven was beautifully crafted and intricate.
Dwarven soldiers usually used axes as their weapon of choice because it can be used as a tool or a weapon, but in addition to axes they used hatchets, mattocks, short swords, war hammers, and very occasionally there is mention of dwarven archers.;
As for armor, Dwarves favored chain-mail and other metallic armor where the most expensive and precious of which was ring mail made of gold.;
Dwarves are a short but stocky race that inhabits Frozen Empire. What a regular dwarf lacks in in height (measuring between 4 and 5 feet), he makes up for in bulk, weighing as much as a mature human. Dwarven males are a bit taller and heavier than their female counterparts.;
Dwarves are unusually tough for humanoids, in more ways than one. Dwarven stomachs, for instance, are resistant to virtually all poisons and it takes less effort for a dwarf to get back on their feet than other races. Dwarves also have dense bodies and are difficult to push around as a result, as well as having the capacity to bear loads, that other races might find hindering, with little ill effect.;
Many dwarves have an affinity for the caverns in which they live, possessing a knack for recognizing unusual patterns in stonework that could almost seem supernatural at times. They are also renowned for their metalworking and crafting abilities.;
All dwarfs have beards and wear up to twelve layers of clothing. Gender is more or less optional.;
Dwarves are short and stocky, easily identifiable by their size and shape. They have ruddy cheeks, dark eyes, and dark hair. Dwarves tend to be dour and taciturn. They are given to hard work, and care little for most humor. They enjoy beer, ale, mead, but most of all, they love gold. There are four racial divisions of dwarves within the realms: shield dwarves, gold dwarves, wild dwarves, and duergar.;
He is obsessed with finding rubies. He will take a hand full of rubies over a chest full of gold any day.;
He secretly hates beer as it's too bitter. Dwarf drinks rum instead.;
He is very attracted to halflings, vastly more so then to other dwarves. But they'd never let their parents find out.;
He constantly 'chalks up' their hands with dirt or dust from rocks to better their grip on their weapon.;
He is scared of orcs, but does everything humanly possibly to deny this.;
Believes he was chosen by their God to do something important. But dwarf has no idea what it is...for now.;
Dwarf can't let a dare or slight against his courage slip by him. Always bites when someone calls him a chicken.;
Likes to hum 'Heigh Ho' to themselves. When asked why, they fervently deny it saying, 'I was not.';
He has an obsession with staking claims throughout the adventure in search of ore and gems. Has personalized metal spikes.;
He actually likes elves ever as one saved them as a child.;
Is very tall for a dwarf and proudly boasts about this often, even when in the company of races much taller than him.;
Likes to keep/store spare tools in his beard.;
Decorates their equipment with menacing spikes. While dwarves look rusty, they are of the highest quality craftsmanship.;
Dwarf doesn't actually drink alcohol. They just case prestidigitation on water to look and taste like alcohol.;
Convinced that a pick-axe is the best melee weapon.;
Obviously dyes their beard. Dwarves are streaks of gray that have been colored to match their original shade, but don't exactly match. Vigorously denies that they dye their beard.;
Dislikes wearing shoes and prefers to be closer to the earth. Often tries to show off his feet calluses.;
Always picks their teeth with a sliver of a stone from their home.;
Tends to be more curious when encountering monstrous humanoids like Orcs or Goblins rather than outright hostile.;
Dwarf has ornate metal bands adorning their beard, of brass and bronze, decorated to pay homage to the adventures they have been on so far.;
Always carries around a small personal cask of ale for emergencies. Dwarf is concerned with filling it immediately after it empties, holds 4 servings of ale.;
Is usually snacking on some form of hard cheese or salted meat.;
Dwarves grimace and complain when they are outside for too long and have not been in a cave, mine, or other underground area for more than 8 days.;
Keeps a record of the giants they've killed with notches in their axe or war hammer handle.;
Dwarf can't understand complicated plans, or they refuse to try. It should be plain and simple, otherwise he drools or something of the like.;
Dwarf builds tiny servants of limited-sentience. Calls them his babies.;
Incredibly and uncomfortably affectionate when drunk.;
Refuses to wear or wield non-dwarven arms and armor.;
Has a metal lower jaw after an unfortunate forge accident. As a result their mouth is always slightly open and the tinniest bit crooked... just enough to irritate the obsessive compulsive.;
He cannot grow a beard, only a moustache.;
Can only grow a beard, no mustache.;
Carries around a small etching of his beautiful wife. Likes to show it off to everyone at every opportunity they get. Reacts badly to anyone who doesn't praise their partners luscious beard.;
Has a large nose that turns red whenever it's cold outside or when he's drunk. Hates being called 'Rudolph'.;
Is very bigoted towards the underdark and everyone/thing from there. Dwarf will often blame problems on the surface world on the underdark. Political corruption? Probably a mind flayer. Those things are real you know. The underdark, such an awful place.;
Likes reading history, especially about heroes and battles that are often overlooked in traditional history books.;
Carries a flask of infinite ale around with them, however, they never seem to be drunk.;
He is missing an eye and he replaced it with a chunk of gold craved to look like an eye.;
Yells unique expletives when angry, such as 'Balldersmith!', 'Haggis!' or 'SON OF AN ELF!';
Hates heights and actively avoids climbing unless they must.;
Is petrified of open water. Dwarf can't swim.;
Skin is so rough that he can light a match on any part of his body.;
Has large hands for someone his size.Hair grows on his knuckles. Carrying things are much easier, as is crushing eggs.;
Thinks mind flayers don't exist, these are just rumors and urban legends. Scoffs at the idea of slaad's too.;
Skilled at playing a harp due to lessons their mother made them take as a child. Is deeply embarrassed by this as harp-players are supposed to be romantic fortune tellers in their clan.;
Attempts to wrestles beasts/animals before hitting them with a weapon.;
Uses dyes made of crushed gems and similar substances to dye hair and beard wild colours.;
Has a stooped posture out of shame for their unnaturally tall and un-dwarf-like body.;
Takes precautions against being out in daylight for too long out of fear for its effects. All the above ground races are constantly exposed to it, after all, and they can't grow decent beards to save their life.;
Carries (does not wear) a copper ring with intricate carvings on its circumference. It is obviously important to them, but they're reluctant to say why.;
Has an intense fascination for plants. Likes flowers the most, with an especial interest for lilies.;
Has a small pet bird for a companion, enjoys whistling songs with it.;
 Talks in his sleep. Has a tendency to admit embarrassing things late at night.;
Collects random animal parts, herbs, spices, and other unique ingredients in an attempt to craft the best ale in the world. Loves this hobby.;
Carries around a small piece of rock and will throw it at opponents in an attempt to distract them for a tick.;
Grew up under a desert. As a result, they're fascinated by ponds and rivers. They like spending their down time by a source of water and can stare at lakes for hours.;
Carries around their own beer stein (its 2 to 3 times the size of a regular one) and will only drink from it.;
Having spent the vast majority of their lives underground they are fascinated by the weather, and keep meticulous notes on it day in and day out.;
Is scared of horses. He will never ride one because they're 'so high up'. Oddly enough, he's fine with climbing mountains.;
Claims they can read the history of a stone simply by touching, licking, and examining the stone closely. Then creates elaborate stories for said stone (which may or may not be exaggerated). Will do this for stone buildings, random pebbles, mountains, any stone really.;
Secretly appreciates elven made weaponry and dreams of learning from a master elven smith.;
There best child hood friend was a goblin, this is never revealed, would hide and play with the goblin growing up. Stories of their adventures are flavored as though the goblin was an imaginary creature.;
Was friends with a half-orc as a child. Now has a very soft spot for them. Will fight orcs to the death no problem.;
Always has to sleep with a rock under there pillow, otherwise they have a horrible nights rest, and wake up on the wrong side of the bed the next morning.;
Is very understanding that not everyone can grow a beard, but scoffs at those that shave butcher their own beards.;
Claims that they are fastest dwarf alive, and that they can move more than 25ft in a turn. ;
Has 15 siblings. At least one drops in unannounced every week, and they fill up the house/hut/guild hall during the holidays.;
Carries a peculiar small stone golem with rubies for eyes. claims it is just a doll from his/her childhood mountain, but attunement and magical energies suggest otherwise.;
Old dwarf (350-380 years old) wears a pair of spectacles with stone rims. Handcrafted and very old. Emblazoned with rubies and lesser gems. Grants low-light vision only in caves and mountain passes.;
Honors their deep dwarf roots by lighting the end of their braids or moustache on fire before battle to intimidate enemies.;
Regrets serving their old god and is looking for a new one.;
Treats all Gnomes and Halflings as Dwarf babies.;
